{
  "schema_version": "1.1",
  "dataset_version": "truth-v1.1",
  "dataset_sha256": "49eadfb7bf99d618b35a6d1ecbd98644664b86da77b3bae81944a054228e6a68",
  "msrv": "1.97",
  "toolchain": "rustc 1.97.1 (8bab26f4f 2026-07-14)",
  "tool_version": "0.2.0",
  "tool_revision": "9bcb000128ed21418a5527d430957ef6765c8c50",
  "configuration_sha256": "bc76ea81609572e33ea76f8568242e91d0e93d80213a27ccac31caf0e1f9650d",
  "catalog_sha256": "4a5f331153b9060105c588953b2e59d73b892cd267ae64c6f56414964021bac5",
  "score_model_version": "2.1",
  "thresholds": {
    "confidence_level": 0.95,
    "max_false_positive_rate": 0.02,
    "min_recall": 0.8,
    "min_positive_samples": 50,
    "min_negative_samples": 149,
    "min_context_coverage": 0.9
  },
  "rules": [
    {
      "rule": "box-dyn-error-in-public-api",
      "sample_size": 4,
      "complete_sample_size": 4,
      "incomplete_sample_size": 0,
      "positive_samples": 2,
      "negative_samples": 2,
      "excluded_labels": 43,
      "true_positives": 2,
      "false_positives": 0,
      "false_negatives": 0,
      "true_negatives": 2,
      "unknown_emissions": 19,
      "duplicate_emissions": 0,
      "suppressed_findings": 0,
      "abstentions": 0,
      "uncovered_contexts": 0,
      "precision": 1.0,
      "recall": 1.0,
      "false_positive_rate": 0.0,
      "false_positive_upper_bound": 0.776393202250021,
      "confidence_level": 0.95,
      "opportunity_coverage": 1.0,
      "context_coverage": 1.0,
      "abstention_rate": 0.0,
      "emitted_count": 21,
      "score_contribution": 0.0,
      "complete_fixtures": 2,
      "incomplete_fixtures": 0,
      "scan_complete": true,
      "evidence_complete": false,
      "decision": "evidence-incomplete"
    },
    {
      "rule": "collect-then-iterate",
      "sample_size": 4,
      "complete_sample_size": 4,
      "incomplete_sample_size": 0,
      "positive_samples": 2,
      "negative_samples": 2,
      "excluded_labels": 41,
      "true_positives": 2,
      "false_positives": 0,
      "false_negatives": 0,
      "true_negatives": 2,
      "unknown_emissions": 18,
      "duplicate_emissions": 0,
      "suppressed_findings": 0,
      "abstentions": 0,
      "uncovered_contexts": 0,
      "precision": 1.0,
      "recall": 1.0,
      "false_positive_rate": 0.0,
      "false_positive_upper_bound": 0.776393202250021,
      "confidence_level": 0.95,
      "opportunity_coverage": 1.0,
      "context_coverage": 1.0,
      "abstention_rate": 0.0,
      "emitted_count": 20,
      "score_contribution": 0.0,
      "complete_fixtures": 2,
      "incomplete_fixtures": 0,
      "scan_complete": true,
      "evidence_complete": false,
      "decision": "evidence-incomplete"
    },
    {
      "rule": "excessive-clone",
      "sample_size": 5,
      "complete_sample_size": 5,
      "incomplete_sample_size": 0,
      "positive_samples": 2,
      "negative_samples": 3,
      "excluded_labels": 39,
      "true_positives": 2,
      "false_positives": 0,
      "false_negatives": 0,
      "true_negatives": 3,
      "unknown_emissions": 18,
      "duplicate_emissions": 0,
      "suppressed_findings": 0,
      "abstentions": 0,
      "uncovered_contexts": 0,
      "precision": 1.0,
      "recall": 1.0,
      "false_positive_rate": 0.0,
      "false_positive_upper_bound": 0.6315968501359612,
      "confidence_level": 0.95,
      "opportunity_coverage": 1.0,
      "context_coverage": 1.0,
      "abstention_rate": 0.0,
      "emitted_count": 20,
      "score_contribution": 0.0,
      "complete_fixtures": 3,
      "incomplete_fixtures": 0,
      "scan_complete": true,
      "evidence_complete": false,
      "decision": "evidence-incomplete"
    },
    {
      "rule": "hardcoded-secrets",
      "sample_size": 4,
      "complete_sample_size": 4,
      "incomplete_sample_size": 0,
      "positive_samples": 2,
      "negative_samples": 2,
      "excluded_labels": 39,
      "true_positives": 2,
      "false_positives": 0,
      "false_negatives": 0,
      "true_negatives": 2,
      "unknown_emissions": 18,
      "duplicate_emissions": 0,
      "suppressed_findings": 0,
      "abstentions": 0,
      "uncovered_contexts": 0,
      "precision": 1.0,
      "recall": 1.0,
      "false_positive_rate": 0.0,
      "false_positive_upper_bound": 0.776393202250021,
      "confidence_level": 0.95,
      "opportunity_coverage": 1.0,
      "context_coverage": 1.0,
      "abstention_rate": 0.0,
      "emitted_count": 20,
      "score_contribution": 0.0,
      "complete_fixtures": 2,
      "incomplete_fixtures": 0,
      "scan_complete": true,
      "evidence_complete": false,
      "decision": "evidence-incomplete"
    },
    {
      "rule": "high-cyclomatic-complexity",
      "sample_size": 4,
      "complete_sample_size": 4,
      "incomplete_sample_size": 0,
      "positive_samples": 2,
      "negative_samples": 2,
      "excluded_labels": 37,
      "true_positives": 2,
      "false_positives": 0,
      "false_negatives": 0,
      "true_negatives": 2,
      "unknown_emissions": 18,
      "duplicate_emissions": 0,
      "suppressed_findings": 0,
      "abstentions": 0,
      "uncovered_contexts": 0,
      "precision": 1.0,
      "recall": 1.0,
      "false_positive_rate": 0.0,
      "false_positive_upper_bound": 0.776393202250021,
      "confidence_level": 0.95,
      "opportunity_coverage": 1.0,
      "context_coverage": 1.0,
      "abstention_rate": 0.0,
      "emitted_count": 20,
      "score_contribution": 0.0,
      "complete_fixtures": 2,
      "incomplete_fixtures": 0,
      "scan_complete": true,
      "evidence_complete": false,
      "decision": "evidence-incomplete"
    },
    {
      "rule": "panic-in-library",
      "sample_size": 4,
      "complete_sample_size": 4,
      "incomplete_sample_size": 0,
      "positive_samples": 2,
      "negative_samples": 2,
      "excluded_labels": 43,
      "true_positives": 2,
      "false_positives": 0,
      "false_negatives": 0,
      "true_negatives": 2,
      "unknown_emissions": 18,
      "duplicate_emissions": 0,
      "suppressed_findings": 0,
      "abstentions": 0,
      "uncovered_contexts": 0,
      "precision": 1.0,
      "recall": 1.0,
      "false_positive_rate": 0.0,
      "false_positive_upper_bound": 0.776393202250021,
      "confidence_level": 0.95,
      "opportunity_coverage": 1.0,
      "context_coverage": 1.0,
      "abstention_rate": 0.0,
      "emitted_count": 20,
      "score_contribution": 0.0,
      "complete_fixtures": 2,
      "incomplete_fixtures": 0,
      "scan_complete": true,
      "evidence_complete": false,
      "decision": "evidence-incomplete"
    },
    {
      "rule": "sql-injection-risk",
      "sample_size": 4,
      "complete_sample_size": 4,
      "incomplete_sample_size": 0,
      "positive_samples": 2,
      "negative_samples": 2,
      "excluded_labels": 36,
      "true_positives": 2,
      "false_positives": 0,
      "false_negatives": 0,
      "true_negatives": 2,
      "unknown_emissions": 16,
      "duplicate_emissions": 0,
      "suppressed_findings": 0,
      "abstentions": 0,
      "uncovered_contexts": 0,
      "precision": 1.0,
      "recall": 1.0,
      "false_positive_rate": 0.0,
      "false_positive_upper_bound": 0.776393202250021,
      "confidence_level": 0.95,
      "opportunity_coverage": 1.0,
      "context_coverage": 1.0,
      "abstention_rate": 0.0,
      "emitted_count": 18,
      "score_contribution": 0.0,
      "complete_fixtures": 2,
      "incomplete_fixtures": 0,
      "scan_complete": true,
      "evidence_complete": false,
      "decision": "evidence-incomplete"
    },
    {
      "rule": "unnecessary-allocation",
      "sample_size": 4,
      "complete_sample_size": 4,
      "incomplete_sample_size": 0,
      "positive_samples": 2,
      "negative_samples": 2,
      "excluded_labels": 51,
      "true_positives": 2,
      "false_positives": 0,
      "false_negatives": 0,
      "true_negatives": 2,
      "unknown_emissions": 18,
      "duplicate_emissions": 0,
      "suppressed_findings": 0,
      "abstentions": 0,
      "uncovered_contexts": 0,
      "precision": 1.0,
      "recall": 1.0,
      "false_positive_rate": 0.0,
      "false_positive_upper_bound": 0.776393202250021,
      "confidence_level": 0.95,
      "opportunity_coverage": 1.0,
      "context_coverage": 1.0,
      "abstention_rate": 0.0,
      "emitted_count": 20,
      "score_contribution": 0.0,
      "complete_fixtures": 2,
      "incomplete_fixtures": 0,
      "scan_complete": true,
      "evidence_complete": false,
      "decision": "evidence-incomplete"
    },
    {
      "rule": "unsafe-block-audit",
      "sample_size": 5,
      "complete_sample_size": 5,
      "incomplete_sample_size": 0,
      "positive_samples": 2,
      "negative_samples": 3,
      "excluded_labels": 41,
      "true_positives": 2,
      "false_positives": 0,
      "false_negatives": 0,
      "true_negatives": 3,
      "unknown_emissions": 18,
      "duplicate_emissions": 0,
      "suppressed_findings": 0,
      "abstentions": 0,
      "uncovered_contexts": 0,
      "precision": 1.0,
      "recall": 1.0,
      "false_positive_rate": 0.0,
      "false_positive_upper_bound": 0.6315968501359612,
      "confidence_level": 0.95,
      "opportunity_coverage": 1.0,
      "context_coverage": 1.0,
      "abstention_rate": 0.0,
      "emitted_count": 20,
      "score_contribution": 0.0,
      "complete_fixtures": 3,
      "incomplete_fixtures": 0,
      "scan_complete": true,
      "evidence_complete": false,
      "decision": "evidence-incomplete"
    },
    {
      "rule": "unwrap-in-production",
      "sample_size": 4,
      "complete_sample_size": 4,
      "incomplete_sample_size": 0,
      "positive_samples": 2,
      "negative_samples": 2,
      "excluded_labels": 38,
      "true_positives": 2,
      "false_positives": 0,
      "false_negatives": 0,
      "true_negatives": 2,
      "unknown_emissions": 19,
      "duplicate_emissions": 0,
      "suppressed_findings": 0,
      "abstentions": 0,